{
  "id": "dlg_intro",
  "name": "인트로 대화",
  "start_node_id": "n1",
  "nodes": [
    {
      "id": "n1",
      "type": "line",
      "speaker": "나레이터",
      "text": "전투 준비를 시작한다.",
      "next": "n2"
    },
    {
      "id": "n2",
      "type": "choice",
      "choices": [
        { "text": "바로 전투", "next": "n3" },
        { "text": "대화 계속", "next": "n4" }
      ]
    },
    {
      "id": "n3",
      "type": "end"
    },
    {
      "id": "n4",
      "type": "setFlag",
      "flag_key": "flags.tutorial.seen",
      "flag_value": true,
      "next": "n3"
    }
  ]
}
